{
  "epochs": [
    {
      "accesses": 20000000,
      "active_region_fraction": 0.25,
      "active_words": 1048576,
      "duration_s": 1.0,
      "epoch_id": "e000",
      "fault_regime": "sbu",
      "fit_limit": 250.0,
      "fit_multiplier": 1.0,
      "grid_carbon_intensity_kgco2e_per_kwh": 0.1,
      "latency_limit_ns": 3.0,
      "read_fraction": 0.7,
      "temperature_c": 75.0,
      "uncertainty": {
        "carbon": 0.25,
        "energy": 0.25,
        "fit": 0.25,
        "latency": 0.125
      },
      "vdd_volts": 0.8,
      "write_fraction": 0.30000000000000004
    },
    {
      "accesses": 20000000,
      "active_region_fraction": 0.25,
      "active_words": 1048576,
      "duration_s": 1.0,
      "epoch_id": "e001",
      "fault_regime": "sbu",
      "fit_limit": 250.0,
      "fit_multiplier": 1.0,
      "grid_carbon_intensity_kgco2e_per_kwh": 0.1,
      "latency_limit_ns": 3.0,
      "read_fraction": 0.7,
      "temperature_c": 75.0,
      "uncertainty": {
        "carbon": 0.25,
        "energy": 0.25,
        "fit": 0.25,
        "latency": 0.125
      },
      "vdd_volts": 0.8,
      "write_fraction": 0.30000000000000004
    },
    {
      "accesses": 20000000,
      "active_region_fraction": 0.25,
      "active_words": 1048576,
      "duration_s": 1.0,
      "epoch_id": "e002",
      "fault_regime": "sbu",
      "fit_limit": 250.0,
      "fit_multiplier": 1.0,
      "grid_carbon_intensity_kgco2e_per_kwh": 0.1,
      "latency_limit_ns": 3.0,
      "read_fraction": 0.7,
      "temperature_c": 75.0,
      "uncertainty": {
        "carbon": 0.25,
        "energy": 0.25,
        "fit": 0.25,
        "latency": 0.125
      },
      "vdd_volts": 0.8,
      "write_fraction": 0.30000000000000004
    },
    {
      "accesses": 20000000,
      "active_region_fraction": 0.25,
      "active_words": 1048576,
      "duration_s": 1.0,
      "epoch_id": "e003",
      "fault_regime": "sbu",
      "fit_limit": 250.0,
      "fit_multiplier": 1.0,
      "grid_carbon_intensity_kgco2e_per_kwh": 0.1,
      "latency_limit_ns": 3.0,
      "read_fraction": 0.7,
      "temperature_c": 75.0,
      "uncertainty": {
        "carbon": 0.25,
        "energy": 0.25,
        "fit": 0.25,
        "latency": 0.125
      },
      "vdd_volts": 0.8,
      "write_fraction": 0.30000000000000004
    },
    {
      "accesses": 20000000,
      "active_region_fraction": 0.25,
      "active_words": 1048576,
      "duration_s": 1.0,
      "epoch_id": "e004",
      "fault_regime": "mbu",
      "fit_limit": 250.0,
      "fit_multiplier": 1.0,
      "grid_carbon_intensity_kgco2e_per_kwh": 0.1,
      "latency_limit_ns": 3.0,
      "read_fraction": 0.7,
      "temperature_c": 75.0,
      "uncertainty": {
        "carbon": 0.25,
        "energy": 0.25,
        "fit": 0.25,
        "latency": 0.125
      },
      "vdd_volts": 0.8,
      "write_fraction": 0.30000000000000004
    },
    {
      "accesses": 20000000,
      "active_region_fraction": 0.25,
      "active_words": 1048576,
      "duration_s": 1.0,
      "epoch_id": "e005",
      "fault_regime": "mbu",
      "fit_limit": 250.0,
      "fit_multiplier": 1.0,
      "grid_carbon_intensity_kgco2e_per_kwh": 0.1,
      "latency_limit_ns": 3.0,
      "read_fraction": 0.7,
      "temperature_c": 75.0,
      "uncertainty": {
        "carbon": 0.25,
        "energy": 0.25,
        "fit": 0.25,
        "latency": 0.125
      },
      "vdd_volts": 0.8,
      "write_fraction": 0.30000000000000004
    },
    {
      "accesses": 20000000,
      "active_region_fraction": 0.25,
      "active_words": 1048576,
      "duration_s": 1.0,
      "epoch_id": "e006",
      "fault_regime": "sbu",
      "fit_limit": 250.0,
      "fit_multiplier": 1.0,
      "grid_carbon_intensity_kgco2e_per_kwh": 0.1,
      "latency_limit_ns": 3.0,
      "read_fraction": 0.7,
      "temperature_c": 75.0,
      "uncertainty": {
        "carbon": 0.25,
        "energy": 0.25,
        "fit": 0.25,
        "latency": 0.125
      },
      "vdd_volts": 0.8,
      "write_fraction": 0.30000000000000004
    },
    {
      "accesses": 20000000,
      "active_region_fraction": 0.25,
      "active_words": 1048576,
      "duration_s": 1.0,
      "epoch_id": "e007",
      "fault_regime": "mbu",
      "fit_limit": 250.0,
      "fit_multiplier": 1.0,
      "grid_carbon_intensity_kgco2e_per_kwh": 0.1,
      "latency_limit_ns": 3.0,
      "read_fraction": 0.7,
      "temperature_c": 75.0,
      "uncertainty": {
        "carbon": 0.25,
        "energy": 0.25,
        "fit": 0.25,
        "latency": 0.125
      },
      "vdd_volts": 0.8,
      "write_fraction": 0.30000000000000004
    },
    {
      "accesses": 20000000,
      "active_region_fraction": 0.25,
      "active_words": 1048576,
      "duration_s": 1.0,
      "epoch_id": "e008",
      "fault_regime": "sbu",
      "fit_limit": 250.0,
      "fit_multiplier": 1.0,
      "grid_carbon_intensity_kgco2e_per_kwh": 0.1,
      "latency_limit_ns": 3.0,
      "read_fraction": 0.7,
      "temperature_c": 75.0,
      "uncertainty": {
        "carbon": 0.25,
        "energy": 0.25,
        "fit": 0.25,
        "latency": 0.125
      },
      "vdd_volts": 0.8,
      "write_fraction": 0.30000000000000004
    },
    {
      "accesses": 20000000,
      "active_region_fraction": 0.25,
      "active_words": 1048576,
      "duration_s": 1.0,
      "epoch_id": "e009",
      "fault_regime": "sbu",
      "fit_limit": 250.0,
      "fit_multiplier": 1.0,
      "grid_carbon_intensity_kgco2e_per_kwh": 0.1,
      "latency_limit_ns": 3.0,
      "read_fraction": 0.7,
      "temperature_c": 75.0,
      "uncertainty": {
        "carbon": 0.25,
        "energy": 0.25,
        "fit": 0.25,
        "latency": 0.125
      },
      "vdd_volts": 0.8,
      "write_fraction": 0.30000000000000004
    },
    {
      "accesses": 20000000,
      "active_region_fraction": 0.25,
      "active_words": 1048576,
      "duration_s": 1.0,
      "epoch_id": "e010",
      "fault_regime": "sbu",
      "fit_limit": 250.0,
      "fit_multiplier": 1.0,
      "grid_carbon_intensity_kgco2e_per_kwh": 0.1,
      "latency_limit_ns": 3.0,
      "read_fraction": 0.7,
      "temperature_c": 75.0,
      "uncertainty": {
        "carbon": 0.25,
        "energy": 0.25,
        "fit": 0.25,
        "latency": 0.125
      },
      "vdd_volts": 0.8,
      "write_fraction": 0.30000000000000004
    },
    {
      "accesses": 20000000,
      "active_region_fraction": 0.25,
      "active_words": 1048576,
      "duration_s": 1.0,
      "epoch_id": "e011",
      "fault_regime": "mbu",
      "fit_limit": 250.0,
      "fit_multiplier": 1.0,
      "grid_carbon_intensity_kgco2e_per_kwh": 0.1,
      "latency_limit_ns": 3.0,
      "read_fraction": 0.7,
      "temperature_c": 75.0,
      "uncertainty": {
        "carbon": 0.25,
        "energy": 0.25,
        "fit": 0.25,
        "latency": 0.125
      },
      "vdd_volts": 0.8,
      "write_fraction": 0.30000000000000004
    },
    {
      "accesses": 20000000,
      "active_region_fraction": 0.25,
      "active_words": 1048576,
      "duration_s": 1.0,
      "epoch_id": "e012",
      "fault_regime": "mbu",
      "fit_limit": 250.0,
      "fit_multiplier": 1.0,
      "grid_carbon_intensity_kgco2e_per_kwh": 0.1,
      "latency_limit_ns": 3.0,
      "read_fraction": 0.7,
      "temperature_c": 75.0,
      "uncertainty": {
        "carbon": 0.25,
        "energy": 0.25,
        "fit": 0.25,
        "latency": 0.125
      },
      "vdd_volts": 0.8,
      "write_fraction": 0.30000000000000004
    },
    {
      "accesses": 20000000,
      "active_region_fraction": 0.25,
      "active_words": 1048576,
      "duration_s": 1.0,
      "epoch_id": "e013",
      "fault_regime": "mbu",
      "fit_limit": 250.0,
      "fit_multiplier": 1.0,
      "grid_carbon_intensity_kgco2e_per_kwh": 0.1,
      "latency_limit_ns": 3.0,
      "read_fraction": 0.7,
      "temperature_c": 75.0,
      "uncertainty": {
        "carbon": 0.25,
        "energy": 0.25,
        "fit": 0.25,
        "latency": 0.125
      },
      "vdd_volts": 0.8,
      "write_fraction": 0.30000000000000004
    },
    {
      "accesses": 20000000,
      "active_region_fraction": 0.25,
      "active_words": 1048576,
      "duration_s": 1.0,
      "epoch_id": "e014",
      "fault_regime": "sbu",
      "fit_limit": 250.0,
      "fit_multiplier": 1.0,
      "grid_carbon_intensity_kgco2e_per_kwh": 0.1,
      "latency_limit_ns": 3.0,
      "read_fraction": 0.7,
      "temperature_c": 75.0,
      "uncertainty": {
        "carbon": 0.25,
        "energy": 0.25,
        "fit": 0.25,
        "latency": 0.125
      },
      "vdd_volts": 0.8,
      "write_fraction": 0.30000000000000004
    },
    {
      "accesses": 20000000,
      "active_region_fraction": 0.25,
      "active_words": 1048576,
      "duration_s": 1.0,
      "epoch_id": "e015",
      "fault_regime": "mbu",
      "fit_limit": 250.0,
      "fit_multiplier": 1.0,
      "grid_carbon_intensity_kgco2e_per_kwh": 0.1,
      "latency_limit_ns": 3.0,
      "read_fraction": 0.7,
      "temperature_c": 75.0,
      "uncertainty": {
        "carbon": 0.25,
        "energy": 0.25,
        "fit": 0.25,
        "latency": 0.125
      },
      "vdd_volts": 0.8,
      "write_fraction": 0.30000000000000004
    }
  ],
  "generator": {
    "accesses_per_epoch": 20000000,
    "epoch_count": 16,
    "family": "uncertain_transitions",
    "period_epochs": 4,
    "relative_uncertainty": 0.25,
    "seed": 1732
  },
  "schema_version": 1,
  "seed": 1732,
  "source": "generated_synthetic",
  "trace_id": "uncertain_transitions"
}
